<?xml version="1.0"?>

<Map
xmlns="mapSpecificationScheema.xsd"
xmlns:xsi="http://www.w3.org/2001/XMLSchema-instance"
xsi:noNamespaceSchemaLocation="mapSpecificationScheema.xsd">
  <MapDimentions>
    <Width>500</Width>
    <Height>500</Height>
  </MapDimentions>
  <Surfaces>
    <BackgoundPicture>
      <Asset name="grid">
        <Scale>
          <X>4</X>
          <Y>3</Y>
        </Scale>
        <Rotation>0.0</Rotation>
        <Position>
          <X>0</X>
          <Y>-500</Y>
        </Position>
      </Asset>
    </BackgoundPicture>
    <MapWalls>
      <Wall walltype="left">
        <Asset name="longWall">
          <Height>300</Height>
          <Width>100</Width>
          <Scale>
            <X>1</X>
            <Y>1</Y>
          </Scale>
          <Rotation>0.0</Rotation>
          <Position>
            <X>0</X>
            <Y>0</Y>
          </Position>
        </Asset>
      </Wall>

      <Wall walltype="right">
        <Asset name="longWall">
          <Height>300</Height>
          <Width>100</Width>
          <Scale>
            <X>1</X>
            <Y>1</Y>
          </Scale>
          <Rotation>0.0</Rotation>
          <Position>
            <X>500</X>
            <Y>0</Y>
          </Position>
        </Asset>
      </Wall>

      <Wall walltype="bottom">
        <Asset name="longPlatform">
          <Height>100</Height>
          <Width>300</Width>
          <Scale>
            <X>1</X>
            <Y>1</Y>
          </Scale>
          <Rotation>0.0</Rotation>
          <Position>
            <X>0</X>
            <Y>0</Y>
          </Position>
        </Asset>
      </Wall>


      <Wall walltype="top">
        <Asset name="longPlatform">
          <Height>100</Height>
          <Width>300</Width>
          <Scale>
            <X>1</X>
            <Y>1</Y>
          </Scale>
          <Rotation>0.0</Rotation>
          <Position>
            <X>0</X>
            <Y>-500</Y>
          </Position>
        </Asset>
      </Wall>


    </MapWalls>
    <Obsticals>
      <Asset name="wall">
        <Height>100</Height>
        <Width>100</Width>
        <Scale>
          <X>1</X>
          <Y>1</Y>
        </Scale>
        <Position>
          <X>0</X>
          <Y>0</Y>
        </Position>
      </Asset>
    </Obsticals>
  </Surfaces>
  <Powerups>
    <Position>
      <X>0</X>
      <Y>0</Y>
    </Position>
  </Powerups>
  <SpawnPoint>
    <Player1>
      <X>100</X>
      <Y>-100</Y>
    </Player1>
    <Player2>
      <X>300</X>
      <Y>-100</Y>
    </Player2>
    <default>
      <X>100</X>
      <Y>0</Y>
    </default>
  </SpawnPoint>

</Map>
